{
  "schemaVersion": 1,
  "providerId": "autobyteus.voice.mlx-whisper-small",
  "profileId": "english",
  "languageMode": "en",
  "target": {
    "platform": "darwin",
    "architecture": "arm64"
  },
  "engine": {
    "kind": "mlx-whisper",
    "version": "0.4.3",
    "configurationSha256": "c892f1f8b2ee99f7580036beb3df2725b4d89615907386ad83e481497ad63a88"
  },
  "acceptedModelManifestSchemaVersion": 1,
  "model": {
    "modelId": "whisper-small-mlx-fp16",
    "family": "whisper",
    "size": "small",
    "precision": "fp16",
    "layoutId": "mlx-whisper-small-v1"
  },
  "requiredFiles": [
    {
      "path": "config.json",
      "role": "configuration"
    },
    {
      "path": "weights.npz",
      "role": "weights"
    }
  ],
  "capabilityDigest": "e69d9facc681a575e4b7e20b27434ce16ff502b19696bffc445dc6d43ec3f3a8",
  "modelTreeAlgorithm": "canonical-path-size-sha256-v1"
}
